{
  "design_principles": [
    {
      "principle": "Make agent changes legible before they land.",
      "rationale": "Visibility is what lets users stay accountable without micromanaging.",
      "source_findings": [
        "THEME-001",
        "PAIN-001"
      ],
      "mental_model_connection": "Users assume they will see changes first.",
      "priority": "high"
    }
  ],
  "opportunity_areas": [
    {
      "opportunity_id": "OPP-001",
      "area": "Change visibility",
      "underlying_need": "When I delegate to an agent, I need to see what changed so I can stay accountable.",
      "current_state": "Users verify manually.",
      "desired_state": "A diff is surfaced before approval.",
      "evidence_strength": "strong (3/3 participants)",
      "complexity": "medium",
      "timeline_estimate": "Q3",
      "design_questions": [
        "What granularity of diff feels like enough?"
      ]
    }
  ],
  "risk_areas": [
    {
      "risk": "Users may trust a done status without verifying.",
      "severity": "medium",
      "source_findings": [
        "PAPER-001"
      ]
    }
  ],
  "research_questions": [
    {
      "question": "Does a pre-approval diff reduce manual verification?",
      "rationale": "Tests the core visibility hypothesis."
    }
  ]
}